{
  "$schema": "https://json-schema.org/draft/2020-12/schema",
  "$id": "https://dicom-test-suite.local/schemas/conformance-run.schema.json",
  "type": "object",
  "additionalProperties": false,
  "required": [
    "schema_version", "run_id", "created_at", "repository", "source",
    "generator", "host", "tools", "instances", "entity", "summary"
  ],
  "properties": {
    "schema_version": { "const": "0.1.0" },
    "run_id": { "type": "string", "pattern": "^[0-9a-f]{64}$" },
    "created_at": { "type": "string", "format": "date-time" },
    "repository": { "$ref": "#/$defs/repository" },
    "source": { "$ref": "#/$defs/source" },
    "generator": { "$ref": "#/$defs/generator" },
    "host": { "$ref": "#/$defs/host" },
    "tools": { "type": "array", "items": { "$ref": "#/$defs/tool" } },
    "instances": { "type": "array", "items": { "$ref": "#/$defs/instance" } },
    "entity": { "$ref": "#/$defs/result" },
    "summary": { "$ref": "#/$defs/summary" }
  },
  "$defs": {
    "sha256": { "type": "string", "pattern": "^[0-9a-f]{64}$" },
    "relative_path": {
      "type": "string", "minLength": 1,
      "pattern": "^(?!/)(?!.*(?:^|/)\\.\\.(?:/|$)).+$"
    },
    "repository": {
      "type": "object", "additionalProperties": false,
      "required": ["commit", "dirty"],
      "properties": {
        "commit": { "type": "string", "minLength": 7 },
        "dirty": { "type": "boolean" }
      }
    },
    "source": {
      "type": "object", "additionalProperties": false,
      "required": ["manifest_path", "manifest_sha256"],
      "properties": {
        "manifest_path": { "$ref": "#/$defs/relative_path" },
        "manifest_sha256": { "$ref": "#/$defs/sha256" }
      }
    },
    "generator": {
      "type": "object", "additionalProperties": false,
      "required": ["identity", "seed", "profile", "features", "standards_lock_sha256"],
      "properties": {
        "identity": { "type": "string", "minLength": 1 },
        "seed": { "type": "integer", "minimum": 0 },
        "profile": { "type": "string", "minLength": 1 },
        "features": { "type": "array", "items": { "type": "string" }, "uniqueItems": true },
        "standards_lock_sha256": { "$ref": "#/$defs/sha256" }
      }
    },
    "host": {
      "type": "object", "additionalProperties": false,
      "required": ["os", "architecture"],
      "properties": {
        "os": { "type": "string", "minLength": 1 },
        "architecture": { "type": "string", "minLength": 1 }
      }
    },
    "tool": {
      "type": "object", "additionalProperties": false,
      "required": ["adapter_id", "role", "status", "required", "executable", "sha256", "lock_status"],
      "properties": {
        "adapter_id": { "type": "string", "minLength": 1 },
        "role": { "type": "string", "minLength": 1 },
        "status": { "enum": ["available", "absent", "misconfigured", "unsupported", "timeout"] },
        "required": { "type": "boolean" },
        "executable": { "type": ["string", "null"] },
        "sha256": { "anyOf": [{ "$ref": "#/$defs/sha256" }, { "type": "null" }] },
        "executable_sha256": { "anyOf": [{ "$ref": "#/$defs/sha256" }, { "type": "null" }] },
        "artifacts": {
          "type": "array",
          "items": {
            "type": "object",
            "additionalProperties": false,
            "required": ["path", "sha256"],
            "properties": {
              "path": { "type": "string", "minLength": 1 },
              "sha256": { "$ref": "#/$defs/sha256" }
            }
          }
        },
        "version_output": { "type": ["string", "null"] },
        "version_exit_code": { "type": ["integer", "null"] },
        "lock_status": { "enum": ["matched", "mismatched", "unlocked", "unavailable"] }
      }
    },
    "artifact": {
      "type": "object", "additionalProperties": false,
      "required": ["path", "sha256"],
      "properties": {
        "path": { "$ref": "#/$defs/relative_path" },
        "sha256": { "$ref": "#/$defs/sha256" }
      }
    },
    "entity_input_projection": {
      "type": "object", "additionalProperties": false,
      "required": ["method", "scope", "file_list", "entries"],
      "properties": {
        "method": { "const": "terminal_pixel_data_element_redaction_v1" },
        "scope": { "const": "entity_consistency_only" },
        "file_list": { "$ref": "#/$defs/artifact" },
        "entries": {
          "type": "array", "minItems": 1,
          "items": {
            "type": "object", "additionalProperties": false,
            "required": ["source_case_id", "source_path", "source_copy", "projected_input", "transfer_syntax_uid", "removed_element"],
            "properties": {
              "source_case_id": { "const": "classic/sc/mono2_u32_explicit_le" },
              "source_path": { "$ref": "#/$defs/relative_path" },
              "source_copy": { "$ref": "#/$defs/artifact" },
              "projected_input": { "$ref": "#/$defs/artifact" },
              "transfer_syntax_uid": { "const": "1.2.840.10008.1.2.1" },
              "removed_element": {
                "type": "object", "additionalProperties": false,
                "required": ["tag", "vr", "element_offset", "value_offset", "value_length", "value_sha256"],
                "properties": {
                  "tag": { "const": "(7FE0,0010)" },
                  "vr": { "const": "OW" },
                  "element_offset": { "type": "integer", "minimum": 0 },
                  "value_offset": { "type": "integer", "minimum": 12 },
                  "value_length": { "const": 16 },
                  "value_sha256": { "$ref": "#/$defs/sha256" }
                }
              }
            }
          }
        }
      }
    },
    "finding": {
      "type": "object", "additionalProperties": false,
      "required": ["severity", "message", "message_fingerprint", "disposition"],
      "properties": {
        "severity": { "enum": ["error", "warning", "info", "tool_failure", "timeout", "unsupported", "unparsed_output"] },
        "rule_id": { "type": ["string", "null"] },
        "message": { "type": "string", "minLength": 1 },
        "message_fingerprint": { "$ref": "#/$defs/sha256" },
        "dicom_path": { "type": ["string", "null"] },
        "disposition": { "enum": ["unresolved", "accepted"] }
      }
    },
    "result": {
      "type": "object", "additionalProperties": false,
      "allOf": [
        {
          "if": { "required": ["input_projection"] },
          "then": { "properties": { "role": { "const": "entity_validator" } } }
        }
      ],
      "required": ["adapter_id", "role", "status", "invocation", "stdout", "stderr", "exit_code", "duration_ms", "timed_out", "findings"],
      "properties": {
        "adapter_id": { "type": "string", "minLength": 1 },
        "role": { "type": "string", "minLength": 1 },
        "status": { "enum": ["completed", "tool_failure", "timeout", "unsupported"] },
        "invocation": { "type": "array", "minItems": 1, "items": { "type": "string" } },
        "stdout": { "$ref": "#/$defs/artifact" },
        "stderr": { "$ref": "#/$defs/artifact" },
        "exit_code": { "type": ["integer", "null"] },
        "duration_ms": { "type": "integer", "minimum": 0 },
        "timed_out": { "type": "boolean" },
        "findings": { "type": "array", "items": { "$ref": "#/$defs/finding" } },
        "unsupported_reason": { "type": "string", "minLength": 1 },
        "input_projection": { "$ref": "#/$defs/entity_input_projection" }
      }
    },
    "pixel": {
      "type": "object", "additionalProperties": false,
      "required": ["status", "independence", "expected_frame_hashes", "actual_frame_hashes", "evidence"],
      "properties": {
        "status": { "enum": ["passed", "failed", "unsupported"] },
        "independence": { "enum": ["independent", "same_implementation", "not_applicable"] },
        "expected_frame_hashes": { "type": "array", "items": { "$ref": "#/$defs/sha256" } },
        "actual_frame_hashes": { "type": "array", "items": { "$ref": "#/$defs/sha256" } },
        "reason": { "type": "string" },
        "evidence": { "anyOf": [{ "$ref": "#/$defs/artifact" }, { "type": "null" }] }
      }
    },
    "icc": {
      "type": "object", "additionalProperties": false,
      "required": ["adapter_id", "status", "independence", "evidence"],
      "properties": {
        "adapter_id": { "const": "littlecms-transicc-icc" },
        "status": { "enum": ["passed", "failed", "unsupported"] },
        "independence": { "const": "independent" },
        "evidence": { "anyOf": [{ "$ref": "#/$defs/artifact" }, { "type": "null" }] }
      }
    },
    "waveform": {
      "type": "object", "additionalProperties": false,
      "required": [
        "adapter_id", "status", "independence", "expected_group_payload_sha256",
        "actual_group_payload_sha256", "expected_group_channel_sha256",
        "actual_group_channel_sha256", "expected_aggregate_payload_sha256",
        "actual_aggregate_payload_sha256", "reason", "evidence"
      ],
      "properties": {
        "adapter_id": { "const": "pydicom-dicom-validator-waveform" },
        "status": { "enum": ["passed", "failed", "unsupported"] },
        "independence": { "const": "independent" },
        "expected_group_payload_sha256": {
          "type": "array", "minItems": 1, "maxItems": 4,
          "items": { "$ref": "#/$defs/sha256" }
        },
        "actual_group_payload_sha256": {
          "type": "array", "maxItems": 4,
          "items": { "$ref": "#/$defs/sha256" }
        },
        "expected_group_channel_sha256": {
          "type": "array", "minItems": 1, "maxItems": 4,
          "items": {
            "type": "array", "minItems": 1, "maxItems": 24,
            "items": { "$ref": "#/$defs/sha256" }
          }
        },
        "actual_group_channel_sha256": {
          "type": "array", "maxItems": 4,
          "items": {
            "type": "array", "maxItems": 24,
            "items": { "$ref": "#/$defs/sha256" }
          }
        },
        "expected_aggregate_payload_sha256": { "$ref": "#/$defs/sha256" },
        "actual_aggregate_payload_sha256": {
          "anyOf": [{ "$ref": "#/$defs/sha256" }, { "type": "null" }]
        },
        "reason": { "type": "string", "minLength": 1 },
        "evidence": { "anyOf": [{ "$ref": "#/$defs/artifact" }, { "type": "null" }] }
      }
    },
    "instance": {
      "type": "object", "additionalProperties": false,
      "allOf": [
        {
          "if": {
            "properties": {
              "case_id": {
                "enum": [
                  "non-image/waveform/twelve_lead_ecg",
                  "non-image/waveform/general_ecg"
                ]
              }
            },
            "required": ["case_id"]
          },
          "then": { "required": ["waveform"] },
          "else": { "not": { "required": ["waveform"] } }
        }
      ],
      "required": ["stable_instance_key", "case_id", "path", "sop_class_uid", "transfer_syntax_uid", "results", "pixel"],
      "properties": {
        "stable_instance_key": { "$ref": "#/$defs/sha256" },
        "case_id": { "type": "string", "minLength": 1 },
        "path": { "$ref": "#/$defs/relative_path" },
        "sop_class_uid": { "type": "string", "pattern": "^[0-9]+(?:\\.[0-9]+)+$" },
        "transfer_syntax_uid": { "type": "string", "pattern": "^[0-9]+(?:\\.[0-9]+)+$" },
        "results": { "type": "array", "items": { "$ref": "#/$defs/result" } },
        "pixel": { "$ref": "#/$defs/pixel" },
        "icc": { "$ref": "#/$defs/icc" },
        "waveform": { "$ref": "#/$defs/waveform" }
      }
    },
    "summary": {
      "type": "object", "additionalProperties": false,
      "required": ["instances", "by_severity", "by_disposition", "by_tool", "by_sop_class", "by_transfer_syntax"],
      "properties": {
        "instances": { "type": "integer", "minimum": 0 },
        "by_severity": { "$ref": "#/$defs/counts" },
        "by_disposition": { "$ref": "#/$defs/counts" },
        "by_tool": { "$ref": "#/$defs/counts" },
        "by_sop_class": { "$ref": "#/$defs/counts" },
        "by_transfer_syntax": { "$ref": "#/$defs/counts" }
      }
    },
    "counts": {
      "type": "object", "additionalProperties": { "type": "integer", "minimum": 0 }
    }
  }
}
